{
  "version": "4.2",
  "scope": "Day1-110 full runtime",
  "generatedAt": "2026-09-25",
  "uiShell": {
    "globalBackground": "ui_bg_global",
    "modalPanel": "ui_panel_modal",
    "primaryButton": "ui_btn_primary",
    "secondaryButton": "ui_btn_secondary",
    "energyChip": "ui_chip_energy",
    "coinChip": "ui_chip_coin",
    "gemChip": "ui_chip_gem",
    "orderCard": "ui_card_order",
    "boardFrame": "board_frame_9x7",
    "boardCellOpen": "board_cell_open",
    "boardCellLocked": "board_cell_locked",
    "boardItemShadow": "board_shadow_item"
  },
  "content": {
    "items": {
      "item_fanqie": "art_item_fanqie",
      "item_caijiao": "art_item_caijiao",
      "item_mogu": "art_item_mogu",
      "item_lajiao": "art_item_lajiao",
      "item_congduan": "art_item_congduan",
      "item_huluobo": "art_item_huluobo",
      "item_yangcong": "art_item_yangcong",
      "item_kafeidou": "art_item_kafeidou",
      "item_nongsuokafei": "art_item_nongsuokafei",
      "item_kafei": "art_item_kafei",
      "item_bianxiekafei": "art_item_bianxiekafei",
      "item_bingkafei": "art_item_bingkafei",
      "item_lvcha": "art_item_lvcha",
      "item_yumili": "art_item_yumili",
      "item_xiangcaojia": "art_item_xiangcaojia",
      "item_yumi": "art_item_yumi",
      "item_xiangcaozi": "art_item_xiangcaozi",
      "dish_shengcaishala": "art_dish_shengcaishala",
      "item_chunniunai": "art_item_chunniunai",
      "item_boliwan": "art_item_boliwan",
      "dish_tangbanfanqie": "art_dish_tangbanfanqie",
      "dish_caijiaocuipian": "art_dish_caijiaocuipian",
      "dish_junxiangzhishijuan": "art_dish_junxiangzhishijuan",
      "dish_shengqiehuluobotiao": "art_dish_shengqiehuluobotiao",
      "item_lanmei": "art_item_lanmei",
      "dish_xianzhalanmeizhi": "art_dish_xianzhalanmeizhi",
      "item_bingtang": "art_item_bingtang",
      "item_caomei": "art_item_caomei",
      "dish_caomeiguolu": "art_dish_caomeiguolu",
      "item_ningmeng": "art_item_ningmeng",
      "dish_shoudaningmengzhi": "art_dish_shoudaningmengzhi",
      "item_shenhongkafei": "art_item_shenhongkafei",
      "item_hongcha": "art_item_hongcha",
      "item_huangyou": "art_item_huangyou",
      "dish_zhenzhunaicha": "art_dish_zhenzhunaicha",
      "item_tangjiang": "art_item_tangjiang",
      "dish_baomihua": "art_dish_baomihua",
      "item_pingguo": "art_item_pingguo",
      "dish_pingguoguoyin": "art_dish_pingguoguoyin",
      "item_zhishipian": "art_item_zhishipian",
      "item_rouchang": "art_item_rouchang",
      "item_peigen": "art_item_peigen",
      "item_rouwan": "art_item_rouwan",
      "item_niuxiongrou": "art_item_niuxiongrou",
      "dish_kaochang": "art_dish_kaochang",
      "dish_yanxunniuxiongrou": "art_dish_yanxunniuxiongrou",
      "item_nengliangyinliao": "art_item_nengliangyinliao",
      "item_xiangbin": "art_item_xiangbin",
      "item_naiyou": "art_item_naiyou",
      "item_pangxie": "art_item_pangxie",
      "item_wulongcha": "art_item_wulongcha",
      "item_jidan": "art_item_jidan",
      "item_xiaomaifen": "art_item_xiaomaifen",
      "item_tanglishui": "art_item_tanglishui",
      "item_xia": "art_item_xia",
      "item_kuangquanshui": "art_item_kuangquanshui",
      "tool_zhenglong": "art_tool_zhenglong",
      "item_tangdou": "art_item_tangdou",
      "item_langmu": "art_item_langmu",
      "item_kele": "art_item_kele",
      "item_ziganlan": "art_item_ziganlan",
      "item_xueyu": "art_item_xueyu",
      "item_pipatui": "art_item_pipatui",
      "item_xianggu": "art_item_xianggu",
      "special_tea_formula_3": "art_special_tea_formula_3",
      "item_feie_jiangyou": "art_item_feie_jiangyou",
      "item_yenai": "art_item_yenai",
      "special_tea_formula_1": "art_special_tea_formula_1",
      "item_shenghao": "art_item_shenghao",
      "item_weishiji": "art_item_weishiji",
      "item_sudashui": "art_item_sudashui",
      "item_jiangzhishui": "art_item_jiangzhishui",
      "special_tea_formula_2": "art_special_tea_formula_2",
      "item_tudou": "art_item_tudou",
      "item_putao": "art_item_putao",
      "item_jiaotang": "art_item_jiaotang",
      "item_zhouzi": "art_item_zhouzi",
      "item_hunhexiangye": "art_item_hunhexiangye",
      "item_youyu": "art_item_youyu",
      "item_shanbei": "art_item_shanbei",
      "special_tea_formula_5": "art_special_tea_formula_5",
      "item_jinqiangyu": "art_item_jinqiangyu",
      "item_qiaokeli": "art_item_qiaokeli",
      "item_daiguquanji": "art_item_daiguquanji",
      "item_wuhuarou": "art_item_wuhuarou",
      "item_dami": "art_item_dami",
      "special_tea_formula_4": "art_special_tea_formula_4",
      "item_jitui": "art_item_jitui",
      "item_huacha": "art_item_huacha",
      "item_mangguo": "art_item_mangguo",
      "item_jixiongrou": "art_item_jixiongrou",
      "item_fengmi": "art_item_fengmi",
      "item_yanmai": "art_item_yanmai",
      "item_shengcai": "art_item_shengcai",
      "item_xilanhua": "art_item_xilanhua",
      "item_futejia": "art_item_futejia",
      "dish_jiaoxiangyangcongfan": "art_dish_jiaoxiangyangcongfan",
      "dish_tankaojixiongrou": "art_dish_tankaojixiongrou",
      "dish_huangyoubanfan": "art_dish_huangyoubanfan",
      "dish_jiangguofengmiyanmaiwang": "art_dish_jiangguofengmiyanmaiwang",
      "dish_tianyuanshala": "art_dish_tianyuanshala",
      "dish_moscow_mule": "art_dish_moscow_mule",
      "item_longshulan": "art_item_longshulan",
      "item_chengzi": "art_item_chengzi",
      "dish_xianzhachengzhi": "art_dish_xianzhachengzhi",
      "dish_longshulan_luosidao": "art_dish_longshulan_luosidao",
      "dish_zhishiregou": "art_dish_zhishiregou",
      "dish_tankao_rouchang": "art_dish_tankao_rouchang",
      "dish_kaoregoumianbao": "art_dish_kaoregoumianbao",
      "item_suan": "art_item_suan",
      "dish_suanxiangmianbao": "art_dish_suanxiangmianbao",
      "dish_huangjinkaozhouzi": "art_dish_huangjinkaozhouzi",
      "dish_shenhongkafei": "art_dish_shenhongkafei",
      "dish_jiangzhishui": "art_dish_jiangzhishui",
      "dish_mizhikaoji": "art_dish_mizhikaoji",
      "dish_xinxianshenghao": "art_dish_xinxianshenghao",
      "dish_langmukele": "art_dish_langmukele",
      "item_li": "art_item_li",
      "item_shuimitao": "art_item_shuimitao",
      "item_yumisui": "art_item_yumisui",
      "item_bingkuai": "art_item_bingkuai",
      "dish_sukao_feixie": "art_dish_sukao_feixie",
      "dish_zaocan_sanmingzhi": "art_dish_zaocan_sanmingzhi",
      "dish_jingying_xianxiajiao": "art_dish_jingying_xianxiajiao",
      "dish_shousi_ziganlan": "art_dish_shousi_ziganlan",
      "dish_suxiang_xueyu": "art_dish_suxiang_xueyu",
      "dish_tankao_pipatui": "art_dish_tankao_pipatui",
      "dish_xianggu_changfen": "art_dish_xianggu_changfen",
      "dish_yezhi_naibai_xiaowan": "art_dish_yezhi_naibai_xiaowan",
      "dish_weishiji_suda": "art_dish_weishiji_suda",
      "dish_liusha_naihuangbao": "art_dish_liusha_naihuangbao",
      "item_dabei_meishi": "art_item_dabei_meishi",
      "dish_kao_tudoupian": "art_dish_kao_tudoupian",
      "dish_putao_guorouyin": "art_dish_putao_guorouyin",
      "dish_jiaotang_malagao": "art_dish_jiaotang_malagao",
      "dish_shijin_haixiantang": "art_dish_shijin_haixiantang",
      "dish_tiandanjiu": "art_dish_tiandanjiu",
      "dish_ee_shouda_ningmengcha": "art_dish_ee_shouda_ningmengcha",
      "dish_tanshao_jinqiangyupai": "art_dish_tanshao_jinqiangyupai",
      "dish_xianshuijiao": "art_dish_xianshuijiao",
      "dish_suzha_dajitui": "art_dish_suzha_dajitui",
      "dish_weishiji_suanjiu": "art_dish_weishiji_suanjiu",
      "dish_caijiao_tudousi": "art_dish_caijiao_tudousi"
    },
    "producers": {
      "prod_shucaileizi": "art_prod_shucaileizi",
      "prod_bingxiang": "art_prod_bingxiang",
      "prod_shuiguolanzi": "art_prod_shuiguolanzi",
      "prod_yinliaogui": "art_prod_yinliaogui",
      "prod_coffee_counter": "art_prod_coffee_counter",
      "prod_grain_crate": "art_prod_grain_crate",
      "prod_prep_supply": "art_prod_prep_supply",
      "prod_kitchen_supply": "art_prod_kitchen_supply",
      "prod_binggui": "art_prod_binggui",
      "prod_xianrouxiaoshou": "art_prod_xianrouxiaoshou",
      "prod_guopen": "art_prod_guopen",
      "prod_haitiaogongju": "art_prod_haitiaogongju",
      "prod_jiushuiyinliaotai": "art_prod_jiushuiyinliaotai",
      "prod_wugumicang": "art_prod_wugumicang"
    },
    "cookwares": {
      "cook_grill": "art_cook_grill",
      "cook_prep_station": "art_cook_prep_station",
      "cook_soup_pot": "art_cook_soup_pot",
      "cook_oven": "art_cook_oven",
      "cook_drink_station": "art_cook_drink_station"
    }
  },
  "characters": {
    "char_manager_001": {
      "canonSheet": "char_manager_001_canon_sheet",
      "avatar": "char_manager_001_avatar",
      "storyPortrait": "char_manager_001_story",
      "sceneSpine": "char_manager_001_spine"
    },
    "char_guide_001": {
      "canonSheet": "char_guide_001_canon_sheet",
      "avatar": "char_guide_001_avatar",
      "storyPortrait": "char_guide_001_story",
      "sceneSpine": "char_guide_001_spine"
    },
    "char_goose_001": {
      "canonSheet": "char_goose_001_canon_sheet",
      "avatar": "char_goose_001_avatar",
      "storyPortrait": "char_goose_001_story",
      "sceneSpine": "char_goose_001_spine"
    },
    "char_goose_002": {
      "canonSheet": "char_goose_002_canon_sheet",
      "avatar": "char_goose_002_avatar",
      "storyPortrait": "char_goose_002_story",
      "sceneSpine": "char_goose_002_spine"
    },
    "char_goose_003": {
      "canonSheet": "char_goose_003_canon_sheet",
      "avatar": "char_goose_003_avatar",
      "storyPortrait": "char_goose_003_story",
      "sceneSpine": "char_goose_003_spine"
    },
    "char_goose_004": {
      "canonSheet": "char_goose_004_canon_sheet",
      "avatar": "char_goose_004_avatar",
      "storyPortrait": "char_goose_004_story",
      "sceneSpine": "char_goose_004_spine"
    },
    "char_goose_005": {